{
  "schema_version": "1.0",
  "run_id": "ccb573a7b0d340798d5210a560adad07",
  "generated_at": "2026-08-14T23:10:07.464765+00:00",
  "candidates": [
    {
      "code": "4751",
      "name": "",
      "meeting_decision": "",
      "official_fundamentals": {
        "ファンダメンタル評価": "",
        "ファンダメンタルスコア": "",
        "ファンダメンタル取得元": ""
      },
      "technical_values": {
        "現在値": 1255.0,
        "RSI14": 33.48,
        "BB位置": "-2.07σ",
        "MA25": 1452.88,
        "MA75": 1375.63,
        "MA200": 1383.42,
        "出来高倍率": 2.49,
        "ATR14": 59.67,
        "ローソク足パターン": "陰線→陽線 / 強気包み足 / 長い下ヒゲ（ハンマー） / 前日安値割れ反転 / 2～5日下落後の陽線",
        "シグナル種別": "BB逆張り / BB＋RSI＋ストキャス",
        "RR": 2.0,
        "損切り候補": 1165.5,
        "利確候補": 1434.0
      },
      "order_plan": {
        "注文方式": "",
        "買いゾーン下限": "",
        "買いゾーン上限": "",
        "損切り価格": "",
        "利確目標": "",
        "RR": 2.0
      }
    },
    {
      "code": "1860",
      "name": "",
      "meeting_decision": "",
      "official_fundamentals": {
        "ファンダメンタル評価": "",
        "ファンダメンタルスコア": "",
        "ファンダメンタル取得元": ""
      },
      "technical_values": {
        "現在値": 1488.5,
        "RSI14": 43.06,
        "BB位置": "-0.65σ",
        "MA25": 1512.7,
        "MA75": 1521.37,
        "MA200": 1407.64,
        "出来高倍率": 1.3,
        "ATR14": 35.6,
        "ローソク足パターン": "強気包み足 / 2～5日下落後の陽線",
        "シグナル種別": "BB逆張り",
        "RR": 2.0,
        "損切り候補": 1435.11,
        "利確候補": 1595.29
      },
      "order_plan": {
        "注文方式": "",
        "買いゾーン下限": "",
        "買いゾーン上限": "",
        "損切り価格": "",
        "利確目標": "",
        "RR": 2.0
      }
    },
    {
      "code": "1968",
      "name": "",
      "meeting_decision": "",
      "official_fundamentals": {
        "ファンダメンタル評価": "",
        "ファンダメンタルスコア": "",
        "ファンダメンタル取得元": ""
      },
      "technical_values": {
        "現在値": 2384.0,
        "RSI14": 40.29,
        "BB位置": "-1.23σ",
        "MA25": 2446.56,
        "MA75": 2622.47,
        "MA200": 2537.28,
        "出来高倍率": 0.91,
        "ATR14": 83.77,
        "ローソク足パターン": "強気包み足 / 2～5日下落後の陽線",
        "シグナル種別": "BB逆張り / 底固め",
        "RR": 2.0,
        "損切り候補": 2258.34,
        "利確候補": 2635.32
      },
      "order_plan": {
        "注文方式": "",
        "買いゾーン下限": "",
        "買いゾーン上限": "",
        "損切り価格": "",
        "利確目標": "",
        "RR": 2.0
      }
    }
  ]
}